[
  {
    "id": "b849f4d6-0fcc-4d0c-a70a-69614e714bb9",
    "tipo": "concepto",
    "categoria": "Supabase",
    "capa": "Base de datos",
    "etiquetas": ["rls", "seguridad"],
    "pregunta": "¿Qué es Row Level Security (RLS) en Supabase y por qué debe estar activo en tablas expuestas?",
    "respuesta": "Es un mecanismo de Postgres que filtra **qué filas** puede leer o modificar cada usuario según políticas. Sin RLS, cualquier cliente con la `anon key` puede leer toda la tabla.",
    "ejemplo": "```sql\nalter table notas enable row level security;\ncreate policy \"propias\" on notas\n  for select using (auth.uid() = user_id);\n```",
    "dificultad": "intermedia",
    "origen": "manual",
    "estado": "revisada",
    "creada": "2026-10-14T12:00:00.000Z",
    "srs": { "due": "2026-10-14T12:00:00.000Z", "stability": 0, "difficulty": 0, "reps": 0, "lapses": 0, "state": "nueva" }
  },
  {
    "id": "50ff758f-922d-42b0-a666-8137ebb81bbe",
    "tipo": "concepto",
    "categoria": "AWS",
    "capa": "Storage",
    "etiquetas": ["s3", "seguridad"],
    "pregunta": "¿Para qué sirve una URL prefirmada (presigned URL) de S3?",
    "respuesta": "Da acceso **temporal** a un objeto privado (leer o subir) sin exponer credenciales. Expira en el tiempo que defines al firmarla.",
    "explicacion": "Útil para que el navegador suba archivos directo a S3 sin pasar por tu servidor.",
    "dificultad": "basica",
    "origen": "manual",
    "estado": "revisada",
    "creada": "2026-10-14T12:00:01.000Z",
    "srs": { "due": "2026-10-14T12:00:01.000Z", "stability": 0, "difficulty": 0, "reps": 0, "lapses": 0, "state": "nueva" }
  },
  {
    "id": "f2472715-3513-43ae-af82-ec0bb3079fe9",
    "tipo": "alternativas",
    "categoria": "Backend",
    "capa": "Red",
    "etiquetas": ["http", "idempotencia"],
    "pregunta": "¿Cuál de estos métodos HTTP **no** es idempotente?",
    "respuesta": "`POST`: repetirlo puede crear varios recursos.",
    "opciones": ["GET", "PUT", "DELETE", "POST"],
    "correcta": 3,
    "explicacion": "PUT y DELETE producen el mismo estado final aunque se repitan.",
    "dificultad": "basica",
    "origen": "manual",
    "estado": "revisada",
    "creada": "2026-10-14T12:00:02.000Z",
    "srs": { "due": "2026-10-14T12:00:02.000Z", "stability": 0, "difficulty": 0, "reps": 0, "lapses": 0, "state": "nueva" }
  },
  {
    "id": "f6f7c6b5-49fa-443b-974c-bc51f35a6733",
    "tipo": "vocabulario",
    "categoria": "Inglés · Software",
    "etiquetas": ["deploy"],
    "pregunta": "**Rollback**",
    "respuesta": "Reversión (volver a una versión anterior)",
    "ejemplo": "We had to roll back the release after the error rate spiked.",
    "explicacion": "Sustantivo: *rollback*. Verbo: *to roll back* (separado). Registro neutro.",
    "idioma": { "lengua": "en", "dominio": "software", "nivel": "B1", "registro": "neutro", "falsos_amigos": [], "audio": true },
    "dificultad": "intermedia",
    "origen": "manual",
    "estado": "revisada",
    "creada": "2026-10-14T12:00:03.000Z",
    "srs": { "due": "2026-10-14T12:00:03.000Z", "stability": 0, "difficulty": 0, "reps": 0, "lapses": 0, "state": "nueva" }
  },
  {
    "id": "f3875924-5c2c-4ab4-ad8d-d1afdf2e4731",
    "tipo": "vocabulario",
    "categoria": "Inglés · Legal",
    "etiquetas": ["contratos"],
    "pregunta": "**Liability**",
    "respuesta": "Responsabilidad (legal o financiera)",
    "ejemplo": "The Supplier's total liability under this Agreement shall not exceed the fees paid.",
    "explicacion": "Muy frecuente en cláusulas de limitación de responsabilidad. Registro formal.",
    "idioma": { "lengua": "en", "dominio": "legal", "nivel": "B2", "registro": "formal", "falsos_amigos": [], "audio": true },
    "dificultad": "intermedia",
    "origen": "manual",
    "estado": "revisada",
    "creada": "2026-10-14T12:00:04.000Z",
    "srs": { "due": "2026-10-14T12:00:04.000Z", "stability": 0, "difficulty": 0, "reps": 0, "lapses": 0, "state": "nueva" }
  },
  {
    "id": "61cee9fb-966a-4cb5-b6a6-ff7dc1a004a4",
    "tipo": "vocabulario",
    "categoria": "Inglés · Finanzas",
    "etiquetas": ["reportes"],
    "pregunta": "**Actual (figures)**",
    "respuesta": "Cifras reales (lo efectivamente ocurrido)",
    "ejemplo": "Actuals came in 4% below budget for Q3.",
    "explicacion": "En reportes financieros se contrasta *actuals* con *budget* o *forecast*.",
    "idioma": { "lengua": "en", "dominio": "finanzas", "nivel": "B2", "registro": "formal", "falsos_amigos": ["actual ≠ actual (de ahora)"], "audio": true },
    "dificultad": "intermedia",
    "origen": "manual",
    "estado": "revisada",
    "creada": "2026-10-14T12:00:05.000Z",
    "srs": { "due": "2026-10-14T12:00:05.000Z", "stability": 0, "difficulty": 0, "reps": 0, "lapses": 0, "state": "nueva" }
  },
  {
    "id": "85ac59c0-d961-4878-8734-c0dc5ab0fc31",
    "tipo": "cloze",
    "categoria": "Supabase",
    "capa": "Edge Functions",
    "etiquetas": ["deno"],
    "pregunta": "Las Edge Functions de Supabase se ejecutan sobre el runtime ____.",
    "respuesta": "Deno",
    "correcta": "Deno",
    "explicacion": "Se escriben en TypeScript y se despliegan con `supabase functions deploy`.",
    "dificultad": "basica",
    "origen": "manual",
    "estado": "revisada",
    "creada": "2026-10-14T12:00:06.000Z",
    "srs": { "due": "2026-10-14T12:00:06.000Z", "stability": 0, "difficulty": 0, "reps": 0, "lapses": 0, "state": "nueva" }
  },
  {
    "id": "63bbad9e-4e96-4395-bc13-5d06d1a9c1fe",
    "tipo": "desafio_codigo",
    "categoria": "Backend",
    "capa": "Lógica",
    "etiquetas": ["typescript", "arrays"],
    "pregunta": "Escribe una función `chunk<T>(arr: T[], size: number): T[][]` que divida un arreglo en grupos de `size` elementos.\n\n`chunk([1,2,3,4,5], 2)` → `[[1,2],[3,4],[5]]`",
    "respuesta": "```ts\nfunction chunk<T>(arr: T[], size: number): T[][] {\n  const out: T[][] = []\n  for (let i = 0; i < arr.length; i += size) {\n    out.push(arr.slice(i, i + size))\n  }\n  return out\n}\n```",
    "explicacion": "Avanza de `size` en `size` y usa `slice`, que no muta el arreglo original. Valida `size > 0` en producción.",
    "dificultad": "intermedia",
    "origen": "manual",
    "estado": "revisada",
    "creada": "2026-10-14T12:00:07.000Z",
    "srs": { "due": "2026-10-14T12:00:07.000Z", "stability": 0, "difficulty": 0, "reps": 0, "lapses": 0, "state": "nueva" }
  }
]
